<?xml version = "1.0" encoding = "ISO-8859-1" ?>

<additional xmlns        = "http://cl/bee/genfrmjava/adddef/schema"
      xmlns:xsi          = "http://www.w3.org/2001/XMLSchema-instance"
      xsi:schemaLocation = "http://cl/bee/genfrmjava/adddef/schema adddef.xsd"
      system             = "SGC"
      form               = "DIR">

  <!-- ========================================================================================== ==
    == FIN_KEY_DBC_DIR
    == ========================================================================================== -->

  <section name="FIN_KEY_DBC_DIR">

    <code><![CDATA[      *<<<< FIN_KEY_DBC_DIR
           MOVE DBC-NUM-TDIR IN DIR-FLD TO DBC-NUM-TDIR IN DBC.
      *>>>>
]]></code>

  </section>

  <!-- ========================================================================================== ==
    == FIN_PUT_DBC_DIR
    == ========================================================================================== -->

  <section name="FIN_PUT_DBC_DIR">

    <code><![CDATA[      *<<<< FIN_PUT_DBC_DIR
           MOVE DBC-GLS-NOMC IN DBC TO CPT-STRN.
           PERFORM CPT-BLKS.
           MOVE CPT-STRN TO DBC-GLS-NOMC IN DIR-FLD.
      *>>>>
]]></code>

  </section>

  <!-- ========================================================================================== ==
    == FIN_VAL_CON_KEY_DIR
    == ========================================================================================== -->

  <section name="FIN_VAL_CON_KEY_DIR">

    <code><![CDATA[      *<<<< FIN_VAL_CON_KEY_DIR
           IF DBC-GLS-NOMC IN DIR-FLD NOT > SPACES AND
              DBC-NUM-ICLI IN DIR-FLD NOT > ZEROES
      *GET-MSG Busca mensaje en tabla
               MOVE 'GNS' TO MSG-COD-SIST
               MOVE 'VALCONKEY' TO MSG-COD-MENS
               PERFORM GET-MSG
               MOVE MSG-GLS-DESC TO FRM-MENS
               MOVE FRM-SUAR-MAL TO FRM-SUAR
               GO TO FIN-VAL-CON-KEY-DIR.
      *>>>>
]]></code>

  </section>

  <!-- ========================================================================================== ==
    == INI_VAL_CON_KEY_DIR
    == ========================================================================================== -->

  <section name="INI_VAL_CON_KEY_DIR">

    <code><![CDATA[      *<<<< INI_VAL_CON_KEY_DIR
           IF FRM-FFLD = FRM-FFLD-PF7 OR FRM-FFLD-PF8
               GO TO FIN-VAL-CON-KEY-DIR.
      *>>>>
]]></code>

  </section>

  <!-- ========================================================================================== ==
    == INI_VAL_FLD_DIR
    == ========================================================================================== -->

  <section name="INI_VAL_FLD_DIR">

    <code><![CDATA[]]></code>

  </section>

  <!-- ========================================================================================== ==
    == PGM_PER
    == ========================================================================================== -->

  <section name="PGM_PER">

    <code><![CDATA[]]></code>

  </section>

  <!-- ========================================================================================== ==
    == RCD_GLS_DIRE
    == ========================================================================================== -->

  <section name="RCD_GLS_DIRE">

    <code><![CDATA[      *<<<< RCD_GLS_DIRE
           IF RCD-GLS-DIRE IN DIR-FLD NOT > SPACES
               PERFORM ERR-GLS.
      *>>>>
      *FSA-AFRI-INI/15042003
           MOVE RCD-GLS-DIRE IN DIR-FLD TO VCL-STRN.
           MOVE 'DIR'                   TO VCL-CMPO.
           MOVE 'N'                     TO VCL-ICOR.
           MOVE 60                      TO VCL-LENG.
           PERFORM SGC-BUS-VCL.
           IF VCL-IERR = 'S'
               MOVE 'SGC'          TO MSG-COD-SIST
               MOVE 'DIRECHARNEX'  TO MSG-COD-MENS
               PERFORM GET-MSG
               MOVE MSG-GLS-DESC TO FRM-MENS
               MOVE FRM-SUAR-MAL TO FRM-SUAR
               GO TO FIN-VAL-RCD-GLS-DIRE.
      *FSA-AFRI-FIN/15042003
]]></code>

  </section>

  <!-- ========================================================================================== ==
    == VAL_CON_FLD_DIR
    == ========================================================================================== -->

  <section name="VAL_CON_FLD_DIR">

    <code><![CDATA[]]></code>

  </section>

  <!-- ========================================================================================== ==
    ==
    == ========================================================================================== -->

</additional>
