<?xml version = "1.0" encoding = "ISO-8859-1" ?>

<additional xmlns        = "http://cl/bee/genfrmjava/adddef/schema"
      xmlns:xsi          = "http://www.w3.org/2001/XMLSchema-instance"
      xsi:schemaLocation = "http://cl/bee/genfrmjava/adddef/schema adddef.xsd"
      system             = "SGC"
      form               = "QTX">

  <!-- ========================================================================================== ==
    == FIN_FRM_COD_CPTO
    == ========================================================================================== -->

  <section name="FIN_FRM_COD_CPTO">

    <code><![CDATA[      *<<<<
           IF FRM-COD-CPTO IN QTX-FLD > SPACES
              MOVE 'SGC'                   TO TAB-COD-SIST
              MOVE 'TXO'                   TO TAB-COD-TTAB IN TAB
              MOVE FRM-COD-CPTO IN QTX-FLD TO TAB-COD-CTAB IN TAB
              PERFORM VAL-COD.
      *>>>>
]]></code>

  </section>

  <!-- ========================================================================================== ==
    == FIN_FRM_FEC_FFIH
    == ========================================================================================== -->

  <section name="FIN_FRM_FEC_FFIH">

    <code><![CDATA[      *<<<<FIN_FRM_FEC_FFIH
           MOVE FRM-NUM-SFID IN QTX-FLD TO WSS-NUM-SFID IN WSS-VARI.
           MOVE FRM-NUM-AFID IN QTX-FLD TO WSS-NUM-AFID IN WSS-VARI.
           MOVE FRM-NUM-MFID IN QTX-FLD TO WSS-NUM-MFID IN WSS-VARI.
           MOVE FRM-NUM-DFID IN QTX-FLD TO WSS-NUM-DFID IN WSS-VARI.

           MOVE FRM-NUM-SFIH IN QTX-FLD TO WSS-NUM-SFIH IN WSS-VARI.
           MOVE FRM-NUM-AFIH IN QTX-FLD TO WSS-NUM-AFIH IN WSS-VARI.
           MOVE FRM-NUM-MFIH IN QTX-FLD TO WSS-NUM-MFIH IN WSS-VARI.
           MOVE FRM-NUM-DFIH IN QTX-FLD TO WSS-NUM-DFIH IN WSS-VARI.
           IF (WSS-FEC-FFID IN WSS-VARI > ZEROES AND
               WSS-FEC-FFIH IN WSS-VARI > ZEROES AND
               WSS-FEC-FFIH IN WSS-VARI NOT > WSS-FEC-FFID IN WSS-VARI)
               MOVE 'SGC'        TO MSG-COD-SIST
               MOVE 'FFIH<FFID'  TO MSG-COD-MENS
               PERFORM GET-MSG
               MOVE MSG-GLS-DESC TO FRM-MENS
               MOVE FRM-SUAR-MAL TO FRM-SUAR
               GO TO FIN-VAL-FRM-FEC-FFIH.
      *>>>>
]]></code>

  </section>

  <!-- ========================================================================================== ==
    == FIN_FRM_FEC_FINH
    == ========================================================================================== -->

  <section name="FIN_FRM_FEC_FINH">

    <code><![CDATA[      *<<<<
           MOVE FRM-NUM-SIND IN QTX-FLD TO WSS-NUM-SIND IN WSS-VARI.
           MOVE FRM-NUM-AIND IN QTX-FLD TO WSS-NUM-AIND IN WSS-VARI.
           MOVE FRM-NUM-MIND IN QTX-FLD TO WSS-NUM-MIND IN WSS-VARI.
           MOVE FRM-NUM-DIND IN QTX-FLD TO WSS-NUM-DIND IN WSS-VARI.

           MOVE FRM-NUM-SINH IN QTX-FLD TO WSS-NUM-SINH IN WSS-VARI.
           MOVE FRM-NUM-AINH IN QTX-FLD TO WSS-NUM-AINH IN WSS-VARI.
           MOVE FRM-NUM-MINH IN QTX-FLD TO WSS-NUM-MINH IN WSS-VARI.
           MOVE FRM-NUM-DINH IN QTX-FLD TO WSS-NUM-DINH IN WSS-VARI.

           IF (WSS-FEC-FIND IN WSS-VARI > ZEROES AND
               WSS-FEC-FINH IN WSS-VARI > ZEROES AND
               WSS-FEC-FINH IN WSS-VARI NOT > WSS-FEC-FIND IN WSS-VARI)
               MOVE 'SGC'        TO MSG-COD-SIST
               MOVE 'FINH<FIND'  TO MSG-COD-MENS
               PERFORM GET-MSG
               MOVE MSG-GLS-DESC TO FRM-MENS
               MOVE FRM-SUAR-MAL TO FRM-SUAR
               GO TO FIN-VAL-FRM-FEC-FINH.
      *>>>>
]]></code>

  </section>

  <!-- ========================================================================================== ==
    == FIN_FRM_MSC_STAT
    == ========================================================================================== -->

  <section name="FIN_FRM_MSC_STAT">

    <code><![CDATA[      *<<<<
           IF FRM-MSC-STAT IN QTX-FLD > SPACES
              MOVE 'GNS'                   TO TAB-COD-SIST
              MOVE 'SON'                   TO TAB-COD-TTAB IN TAB
              MOVE FRM-MSC-STAT IN QTX-FLD TO TAB-COD-CTAB IN TAB
              PERFORM VAL-COD.
      *>>>>
]]></code>

  </section>

  <!-- ========================================================================================== ==
    == INI_FRM_FEC_FFID
    == ========================================================================================== -->

  <section name="INI_FRM_FEC_FFID">

    <code><![CDATA[MAN        MOVE FEC-CHOY-N TO FEC-CHOY.
MAN        MOVE FEC-VHBL-N TO FEC-VHBL.
]]></code>

  </section>

  <!-- ========================================================================================== ==
    == INI_FRM_FEC_FFIH
    == ========================================================================================== -->

  <section name="INI_FRM_FEC_FFIH">

    <code><![CDATA[MAN        MOVE FEC-CHOY-N TO FEC-CHOY.
MAN        MOVE FEC-VHBL-N TO FEC-VHBL.
]]></code>

  </section>

  <!-- ========================================================================================== ==
    == INI_FRM_FEC_FIND
    == ========================================================================================== -->

  <section name="INI_FRM_FEC_FIND">

    <code><![CDATA[MAN        MOVE FEC-CHOY-N TO FEC-CHOY.
MAN        MOVE FEC-VHBL-N TO FEC-VHBL.
]]></code>

  </section>

  <!-- ========================================================================================== ==
    == INI_FRM_FEC_FINH
    == ========================================================================================== -->

  <section name="INI_FRM_FEC_FINH">

    <code><![CDATA[MAN        MOVE FEC-CHOY-N TO FEC-CHOY.
MAN        MOVE FEC-VHBL-N TO FEC-VHBL.
]]></code>

  </section>

  <!-- ========================================================================================== ==
    == INI_NUM_FLD_QTX
    == ========================================================================================== -->

  <section name="INI_NUM_FLD_QTX">

    <code><![CDATA[     *<<<<INI_EDT_FLD_QTX
           IF FRM-NUM-ITXO-LEN IN QTX-FLD(1) = FRM-ERR-NUME
                MOVE FRM-IND-ERRO TO FRM-NUM-ITXO-LEN IN QTX-FLD(1)
                GO TO FIN-EDT-FLD-QTX.
           MOVE FRM-NUM-ITXO IN QTX-FLD(1) TO
                FRM-NUM-ITXO-EDT IN QTX-EDT.
           MOVE FRM-NUM-ITXO-EDT IN QTX-EDT TO
                FRM-NUM-ITXO-ALF IN QTX-FLD(1).
           IF FRM-NUM-ITXO-LEN IN QTX-FLD(2) = FRM-ERR-NUME
                MOVE FRM-IND-ERRO TO FRM-NUM-ITXO-LEN IN QTX-FLD(2)
                GO TO FIN-EDT-FLD-QTX.
           MOVE FRM-NUM-ITXO IN QTX-FLD(2) TO
                FRM-NUM-ITXO-EDT IN QTX-EDT.
           MOVE FRM-NUM-ITXO-EDT IN QTX-EDT TO
                FRM-NUM-ITXO-ALF IN QTX-FLD(2).
           IF FRM-NUM-ITXO-LEN IN QTX-FLD(3) = FRM-ERR-NUME
                MOVE FRM-IND-ERRO TO FRM-NUM-ITXO-LEN IN QTX-FLD(3)
                GO TO FIN-EDT-FLD-QTX.
           MOVE FRM-NUM-ITXO IN QTX-FLD(3) TO
                FRM-NUM-ITXO-EDT IN QTX-EDT.
           MOVE FRM-NUM-ITXO-EDT IN QTX-EDT TO
                FRM-NUM-ITXO-ALF IN QTX-FLD(3).
           IF FRM-NUM-ITXO-LEN IN QTX-FLD(4) = FRM-ERR-NUME
                MOVE FRM-IND-ERRO TO FRM-NUM-ITXO-LEN IN QTX-FLD(4)
                GO TO FIN-EDT-FLD-QTX.
           MOVE FRM-NUM-ITXO IN QTX-FLD(4) TO
                FRM-NUM-ITXO-EDT IN QTX-EDT.
           MOVE FRM-NUM-ITXO-EDT IN QTX-EDT TO
                FRM-NUM-ITXO-ALF IN QTX-FLD(4).
           IF FRM-NUM-ITXO-LEN IN QTX-FLD(5) = FRM-ERR-NUME
                MOVE FRM-IND-ERRO TO FRM-NUM-ITXO-LEN IN QTX-FLD(5)
                GO TO FIN-EDT-FLD-QTX.
           MOVE FRM-NUM-ITXO IN QTX-FLD(5) TO
                FRM-NUM-ITXO-EDT IN QTX-EDT.
           MOVE FRM-NUM-ITXO-EDT IN QTX-EDT TO
                FRM-NUM-ITXO-ALF IN QTX-FLD(5).
]]></code>

  </section>

  <!-- ========================================================================================== ==
    ==
    == ========================================================================================== -->

</additional>
