<?xml version = "1.0" encoding = "ISO-8859-1" ?>

<additional xmlns        = "http://cl/bee/genfrmjava/adddef/schema"
      xmlns:xsi          = "http://www.w3.org/2001/XMLSchema-instance"
      xsi:schemaLocation = "http://cl/bee/genfrmjava/adddef/schema adddef.xsd"
      system             = "SGC"
      form               = "IPC">

  <!-- ========================================================================================== ==
    == FIN_IPC_COD_TDOC
    == ========================================================================================== -->

  <section name="FIN_IPC_COD_TDOC">

    <code><![CDATA[      *<<<< FIN_VAL_IPC_COD_TDOC
           MOVE 'SGC' TO TAB-COD-SIST.
           MOVE 'TFO' TO TAB-COD-TTAB IN TAB.
           MOVE IPC-COD-TDOC IN IPC-FLD TO TAB-COD-CTAB IN TAB.
           PERFORM VAL-COD.
           IF MSG-COD-MENS NOT = SPACES
              MOVE 'SGC'        TO MSG-COD-SIST
              MOVE 'COD    EXI  ' TO MSG-COD-MENS
              PERFORM GET-MSG
              MOVE MSG-GLS-DESC TO FRM-MENS
              MOVE FRM-SUAR-MAL TO FRM-SUAR.
      *>>>>
]]></code>

  </section>

  <!-- ========================================================================================== ==
    == FIN_PUT_DBC_IPC
    == ========================================================================================== -->

  <section name="FIN_PUT_DBC_IPC">

    <code><![CDATA[      *<<<< FIN_PUT_DBC_IPC
           MOVE DBC-GLS-NOMC IN DBC TO CPT-STRN.
           PERFORM CPT-BLKS.
           MOVE CPT-STRN            TO DBC-GLS-NOMC IN IPC-FLD.
      *>>>>
]]></code>

  </section>

  <!-- ========================================================================================== ==
    == FIN_PUT_RPR_IPC
    == ========================================================================================== -->

  <section name="FIN_PUT_RPR_IPC">

    <code><![CDATA[      *BUS-TAB busca glosa de codigo en tabla
           IF RPR-IND-ESTA IN IPC-FLD > SPACES
               MOVE 'SGC' TO TAB-COD-SIST
               MOVE 'EST ' TO TAB-COD-TTAB IN TAB
               MOVE RPR-IND-ESTA IN IPC-FLD TO TAB-COD-CTAB IN TAB
               PERFORM BUS-TAB
               MOVE TAB-GLS-DESC IN TAB TO
                    FRM-GLS-ESTA IN IPC-FLD
           ELSE
               MOVE SPACES TO FRM-GLS-ESTA IN IPC-FLD.
]]></code>

  </section>

  <!-- ========================================================================================== ==
    == FIN_VAL_CON_KEY_IPC
    == ========================================================================================== -->

  <section name="FIN_VAL_CON_KEY_IPC">

    <code><![CDATA[      *<<<< FIN_VAL_CON_KEY_IPC
           IF     DBC-NUM-ICLI IN IPC-FLD NOT > ZEROES
              AND IPC-IIC-IFOL IN IPC-FLD NOT > SPACES
                PERFORM ERR-KEY
                PERFORM FST-KEY-IPC.

            IF    IPC-COD-TDOC IN IPC-FLD NOT > SPACES
                PERFORM ERR-KEY
                MOVE 'S' TO FRM-UCUR
                MOVE -1 TO IPC-COD-TDOC-LEN IN IPC-FLD
                MOVE FRM-POS-CURS TO IPC-COD-TDOC-LEN IN IPC-FLD.
      *>>>>
]]></code>

  </section>

  <!-- ========================================================================================== ==
    == INI_FST_KEY_IPC
    == ========================================================================================== -->

  <section name="INI_FST_KEY_IPC">

    <code><![CDATA[      *<<<< INI_FST_KEY_IPC
           MOVE -1 TO DBC-NUM-ICLI-LEN IN IPC-FLD.
      *>>>>
]]></code>

  </section>

  <!-- ========================================================================================== ==
    ==
    == ========================================================================================== -->

</additional>
