<?xml version = "1.0" encoding = "ISO-8859-1" ?>

<additional xmlns        = "http://cl/bee/genfrmjava/adddef/schema"
      xmlns:xsi          = "http://www.w3.org/2001/XMLSchema-instance"
      xsi:schemaLocation = "http://cl/bee/genfrmjava/adddef/schema adddef.xsd"
      system             = "SGC"
      form               = "CCA">

  <!-- ========================================================================================== ==
    == CAC_COD_CPTO
    == ========================================================================================== -->

  <section name="CAC_COD_CPTO">

    <code><![CDATA[      *<<<< CAC_COD_CPTO
           IF CAC-COD-CPTO IN CCA-FLD NOT > SPACES
              GO TO FIN-VAL-CAC-COD-CPTO.

      *VAL-COD Valida codigo de tabla
           MOVE 'TAB'                   TO TAB-COD-SIST.
           MOVE 'PSC'                   TO TAB-COD-TTAB IN TAB.
           MOVE CAC-COD-CPTO IN CCA-FLD TO TAB-COD-CTAB IN TAB.
           PERFORM VAL-COD.
      *>>>>
]]></code>

  </section>

  <!-- ========================================================================================== ==
    == CAC_IND_VIGE
    == ========================================================================================== -->

  <section name="CAC_IND_VIGE">

    <code><![CDATA[      *<<<< CAC_IND_VIGE
           IF CAC-IND-VIGE IN CCA-FLD NOT > SPACES
              GO TO FIN-VAL-CAC-IND-VIGE.

      *VAL-COD Valida codigo de tabla
           MOVE 'TAB'                   TO TAB-COD-SIST.
           MOVE 'VIG'                   TO TAB-COD-TTAB IN TAB.
           MOVE CAC-IND-VIGE IN CCA-FLD TO TAB-COD-CTAB IN TAB.
           PERFORM VAL-COD.
           IF MSG-COD-MENS = 'COD    NEX' OR 'COD    NVG'
              MOVE MSG-GLS-DESC TO FRM-MENS
              MOVE FRM-SUAR-MAL TO FRM-SUAR.
      *>>>>
]]></code>

  </section>

  <!-- ========================================================================================== ==
    == DBC_GLS_ICLI
    == ========================================================================================== -->

  <section name="DBC_GLS_ICLI">

    <code><![CDATA[      *<<<< DBC_GLS_ICLI
           IF DBC-NUM-ICLI IN CCA-FLD > ZEROES
              MOVE DBC-NUM-ICLI IN CCA-FLD TO DBC-NUM-ICLI IN DBC
              MOVE DBC-IND-ICLI IN CCA-FLD TO DBC-IND-ICLI IN DBC
              MOVE DBC-GLS-ICLI IN CCA-FLD TO DBC-GLS-ICLI IN DBC
              MOVE 'DBC-IDC-ICLI'  TO FIO-AKEY
              MOVE FIO-GET-KEY TO FIO-CMND
              PERFORM SGC-FIO-DBC
              IF NOT FIO-STAT-OKS
                  MOVE 'SGC'        TO MSG-COD-SIST
                  MOVE 'CLI    NEX' TO MSG-COD-MENS
                  PERFORM GET-MSG
                  MOVE MSG-GLS-DESC TO FRM-MENS
                  MOVE FRM-SUAR-MAL TO FRM-SUAR
                  GO TO FIN-VAL-DBC-GLS-ICLI
              ELSE
                 MOVE DBC-NUM-ICLI IN DBC TO WSS-NUM-ICLI IN WSS-VARI
                 MOVE DBC-IND-ICLI IN DBC TO WSS-IND-ICLI IN WSS-VARI
                 MOVE DBC-GLS-ICLI IN DBC TO WSS-GLS-ICLI IN WSS-VARI
                 MOVE DBC-VRF-ICLI IN DBC TO WSS-VRF-ICLI IN WSS-VARI
                 MOVE DBC-CAI-ICLI IN DBC TO WSS-CAI-ICLI IN WSS-VARI
                 MOVE DBC-IIC-ICLI IN DBC TO WSS-IIC-ICLI IN WSS-VARI
                 MOVE DBC-CAI-ICLI IN DBC TO SCR-CAI-ICLI
                 MOVE DBC-IIC-ICLI IN DBC TO SCR-IIC-ICLI.
      *>>>>
]]></code>

  </section>

  <!-- ========================================================================================== ==
    == DBC_NUM_ICLI
    == ========================================================================================== -->

  <section name="DBC_NUM_ICLI">

    <code><![CDATA[      *<<<< DBC_NUM_ICLI
           IF DBC-NUM-ICLI IN CCA-FLD NOT > ZEROES
               MOVE SPACES TO SCR-CAI-ICLI IN SCR-VARI
               MOVE SPACES TO SCR-IIC-ICLI IN SCR-VARI.
      *>>>>
]]></code>

  </section>

  <!-- ========================================================================================== ==
    == FIN_FST_KEY_CCA
    == ========================================================================================== -->

  <section name="FIN_FST_KEY_CCA">

    <code><![CDATA[      *<<<< FIN_FST_KEY_CCA
           MOVE -1 TO CAC-COD-CPTO-LEN IN CCA-FLD.
      *>>>>
]]></code>

  </section>

  <!-- ========================================================================================== ==
    == INI_CAC_FEC_FINI
    == ========================================================================================== -->

  <section name="INI_CAC_FEC_FINI">

    <code><![CDATA[      *<<<< INI_CAC_FEC_FINI
           MOVE FEC-CHOY-N  TO FEC-CHOY.
           MOVE FEC-VHBL-N TO FEC-VHBL.
      *>>>>
]]></code>

  </section>

  <!-- ========================================================================================== ==
    == INI_CAC_HRA_HINI
    == ========================================================================================== -->

  <section name="INI_CAC_HRA_HINI">

    <code><![CDATA[           IF CAC-HRA-HINI IN CCA-FLD NOT > ZEROES
              MOVE ZEROES TO CAC-HRA-HINI IN CCA-FLD
              GO TO FIN-VAL-CAC-HRA-HINI.
           IF CAC-HRA-HINI IN CCA-FLD > 235959
              MOVE 'SGC'          TO MSG-COD-SIST
              MOVE 'HRAINV      ' TO MSG-COD-MENS
              PERFORM GET-MSG
              MOVE MSG-GLS-DESC TO FRM-MENS
              MOVE FRM-SUAR-MAL TO FRM-SUAR
              GO TO FIN-VAL-CAC-HRA-HINI.
]]></code>

  </section>

  <!-- ========================================================================================== ==
    == INI_FRM_FEC_INIS
    == ========================================================================================== -->

  <section name="INI_FRM_FEC_INIS">

    <code><![CDATA[      *<<<<
           MOVE FEC-CHOY-N TO FEC-CHOY.
           MOVE FEC-VHBL-N TO FEC-VHBL.
      *>>>>
]]></code>

  </section>

  <!-- ========================================================================================== ==
    == INI_FRM_HRA_INIS
    == ========================================================================================== -->

  <section name="INI_FRM_HRA_INIS">

    <code><![CDATA[           IF FRM-HRA-INIS IN CCA-FLD > 235959
              MOVE 'SGC'          TO MSG-COD-SIST
              MOVE 'HRAINV      ' TO MSG-COD-MENS
              PERFORM GET-MSG
              MOVE MSG-GLS-DESC TO FRM-MENS
              MOVE FRM-SUAR-MAL TO FRM-SUAR
              GO TO FIN-VAL-FRM-HRA-INIS.
]]></code>

  </section>

  <!-- ========================================================================================== ==
    ==
    == ========================================================================================== -->

</additional>
